id,title,username,time,views,views_detail,supported,description,full_complaint,rating,company_response,url,comments_count,comments
32599126,Kıbrıs Vuni Palas Otelde Tadilat Ve Gürültü Nedeniyle Rahatsız Edici Konaklama Deneyimi,,29 Mayıs 16:23,,395,0,,"Setur aracılığıyla Kıbrıs Vuni Palas 'tan 23.05.2025-26.05.2025 tarihinde rezervasyon yaptırdığım Kıbrıs Vuni Palas ile ilgili ciddi bir memnuniyetsizlik yaşadım.Otele giriş yaptıktan sonra otelin tadilat halinde olduğunu, birçok bölümün kapalı olduğunu ve otel genelinde yoğun bir gürültü ve boya kokusu olduğunu üzülerek deneyimledim. Maalesef bu durum, tatil amacımıza tamamen ters düşmekte ve konaklama süremizi oldukça rahatsız edici hale getirmiştir.Rezervasyon öncesinde otelin tadilatta olduğu ve hizmetlerin kısıtlı olacağı yönünde hiçbir bilgilendirme yapılmadı. Bu tür önemli bir bilginin tarafımıza iletilmemiş olması, hem şeffaflığa hem de müşteri memnuniyetine aykırıdır.",,,https://www.sikayetvar.com/setur-turizm/kibris-vuni-palas-otelde-tadilat-ve-gurultu-nedeniyle-rahatsiz-edici-konaklama-deneyimi,0,[]
32596832,"Setur Turizm Sitesinde İndirimli Fiyat Uygulanmıyor, Rezervasyon Yapılamıyor",,29 Mayıs 13:04,,1.237,0,,Setur sitesinden otele rezervasyon yapacağım world karta yüzde 3 indirim var. Oteli sepetime ekledim. 49920 yazdı sonra 3 indirimle 47400 e düştü. Ödeme yapmak için bilgileri düzenledim ama 49920 den aşağı düşmedi. Ekstra 3 indirim yansıtılmıyor. Sistemsel bir hata yüzünden rezervasyon yapamadım ve fiyatlar da değişiyor. Müşteriyi mağdur ediyorsunuz. Böyle yaparak.,,,https://www.sikayetvar.com/setur-turizm/setur-turizm-sitesinde-indirimli-fiyat-uygulanmiyor-rezervasyon-yapilamiyor,0,[]
32590302,Setur Rezervasyon İptali İçin Çağrı Merkezinden Çözüm Alamıyorum,,28 Mayıs 18:36,,3.969,0,,Seturdan yaptığım 1135151 numaralı rezervasyonumu 444 28 22 numaralı çağrı merkezinden iptal edemiyorum. 3 gün geçmesine rağmen oyalandırılıyorum. Seturdan rezervasyon yaparken 2 kere düşünmek gerekiyor. Rezervasyonumun iptali için gerekli adımların hemen yapılmasını istiyorum.,,Sorunum çözüldü,https://www.sikayetvar.com/setur-turizm/setur-rezervasyon-iptali-icin-cagri-merkezinden-cozum-alamiyorum,0,[]
32586965,,,28 Mayıs 14:02,,,0,,,,,,0,[]
32586020,Setur Müşteri Hizmetlerine Ulaşamama Ve Pasaport Düzeltme Sorunu,,28 Mayıs 12:37,,1.107,0,,"Setur Müşteri Hizmetlerine Ulaşamıyorum...Yakın zamanda turumuz var, pasaport numarasının düzeltilmesi gerekiyor. Bunu fark ettikten hemen sonra Müşteri hizmetlerini defalarca aradık. 20 dakika, 30 dakika bekletme var muhatap yok. Acil dönüş yapar mısınız?.",,"Değerli Misafirimiz;

Şikayetiniz tarafımıza ulaşmıştır. Şikayetiniz, yetkililer tarafından incelenip tarafınıza en kısa sürede geri dönüş sağlanacaktır.

Saygılarımızla",https://www.sikayetvar.com/setur-turizm/setur-musteri-hizmetlerine-ulasamama-ve-pasaport-duzeltme-sorunu,0,[]
32578471,Setur'dan Yetersiz Destek Ve İlgisizlik Nedeniyle Mağduriyet,,27 Mayıs 17:21,,,0,,"Setur Genel Müdürlüğüne, Yetkili merciye18.05.-25.05.2025 tarihli İspanya gezisini 15.04.2025 tarihinde Levent acentenizden satın aldık. Havaalanında yaşadığımız bir sıkıntı nedeniyle, biniş kartımız THY yetkilisi tarafından kaşelendiği halde uçağa binemedik. O andan sonra, uçağın içinde olan rehberimizle iletişime geçtik. Rehberimiz, tur acentamızı aramamız gerektiğini ve onların bu işi çözeceğini söyledi. Bunun üzerine C** Bey'i aramaya başladık. Kendisi bize telefon numarası verip her zaman arayabileceğimizi söylemişti. Yüzlerce defa aradık fakat ulaşamadık. (Kendisi, her şey olup bittikten sonra ertesi gün mesaj atmış; nöbetçi E**** ve V**** Beylerin olduğunu belirtmiş. Nöbetçi ne işe yarar!) Kendi çabamızla, öğlen uçağına THY'den iki yer ayarladık. (Tur biletlerinde değişim olmuyormuş.) Daha sonra V**** Bey aradı ve uçağa binemediğimizi öğrendi. Bize moral verip, ""Problem değil, halletmeye çalışırız"" demek yerine, ""Siz dönün, mahkemeye falan gidip bu iş çözülür"" gibi şeyler söyleyip, bizi sorguladı ve haklarımızı aramamızı önerdi. Biz zaten uçuyoruz, bize transfer ayarlayın, yardımcı olun, bir akıl verin dedikçe, ""Ben hiçbir şekilde yardımcı olamam, bizim şirketin böyle bir yetkisi yok"" dedi. Sadece para almayı mı biliyorsunuz? Havaalanından 200 Euro ödeyerek otele vardık. Bir hafta boyunca acentenizden hiç kimse arayıp ne yaptığımızı, ne olduğunu sormadı.Bütün teşekkürler THY ve tur rehberimiz E*** S*****’e.1- İnsanlar, ilerleyen yaşlarında birikimleriyle katıldıkları bu organizasyonlarda mağdur mu olacaklar?2- Bizlerin maddi ve manevi mağduriyetini kim karşılayacak?3- Amaç suçlu aramak mı, çözüm bulmak mı?Bir de memnuniyet anketi yolluyorsunuz.Gerekli yerlere, Setur firmasında yaşadıklarımızı bildirdik. (Bakanlık ve CİMER)Her türlü kanuni haklarımız saklı kalmak şartıyla, sizlere kısaca yaşadıklarımızı anlattım. Gerekenlere gerekeni yaparsınız umarım.Saygılarımızla",,,https://www.sikayetvar.com/setur-turizm/seturdan-yetersiz-destek-ve-ilgisizlik-nedeniyle-magduriyet,0,[]
32573010,Setur İle Tayland Tatilim Hastalık Ve İlgisizlikle Kabusa Döndü,,27 Mayıs 10:20,,422,0,,"Setur turizm acentasıyla Tayland tatili için Meydan şubesinde anlaşma yaptım. Otele gittiğimde ikinci gün nevresimde pire gördüm. Pattaya'ya giderken tuttukları otobüs sorunluydu, sadece arkadaki koltukta yay vardı. Midem mahvoldu, o gece hasta oldum ve ateşlendim. Phuket'ten Pattaya'ya 12 saatte geldik ve çok kötü oldum. Yol yorgunu ve hasta oldum. Bir de ödediğimiz gösteriye gitmemi istiyorlar. Rehbere ateşlendiğimi, hasta olduğumu ve arabanızdan dolayı hasta olduğumu söyledim, sizin suçunuz dedim ama umursamadı bile. Sabah da kötü olduğum için diğer aktiviteye gidemedim. Kesinlikle tavsiye etmeyeceğim bir firma. Setur seyahat acentesinin rehberine sözü bile geçmedi. Tayland gibi bilmediğim bir şehirde rehberle tartışma ve diyalog yaşadık. Bir daha asla tercih etmem.",,,https://www.sikayetvar.com/setur-turizm/setur-ile-tayland-tatilim-hastalik-ve-ilgisizlikle-kabusa-dondu,0,[]
32566215,Seturdan Kirli Ve Sorunlu Oda Mağduriyeti Üzerine İlgisiz Müşteri Hizmeti,,26 Mayıs 16:30,,1.907,0,,"Setur üzerinden 17-19 Mayıs Ankara Çankaya da konaklama hizmet alımı gerçekleştirdim. Odanın görselleri Setur 'un web sitesine koydukları ile alakasızdı. Parkeler kırık, duş ışığı yanmıyor, oda lağım kokuyor, yatakta saçlar ve pislerler mevcut, yatak kırık ve oda kapısına yapışık. Bu odayı gördüğümüzde yaşanan yıkıntı ile direkt Setur 444 2 822 hattı arayıp otelin değiştirilmesini talep ettim. Şehirlerarası yol gittiğimiz ve yorgun olduğumuzu dinlenme ihtiyacımızı belirttik. Setur 'dan konuyu yetkililere iletelim tarafınıza dönüş yapacağız denildi, 30 dak ara ile 3 kez aradığımda hala dönüş alamamıştık ve vakit kaybımız 1,5 saati geçmişti. Bunun sonucunda resepsiyona inerek durumu anlattım otelde başka oda olmadığı söylenildi ilk, Setur 'u tekrar aradım iade istedim ve iade paramla otel aramaya başlayacaktım. Setur görevlisi iadenin 10 iş gününde olacağını, 2 taksit ödediğim için 2 taksitle iade edilebileceğini, yetkililerden dönüş beklediği belirtti. Bu süreçte hukuki süreci başlatacağımı belirtmemizin akabinde otel bize başka bir oda sundu. Kredi kartımızda yeni otelden yer tutacak limit olmadığı için mecburen sunulan diğer odaya tamam demek durumda kaldık. Bu oda da kötünün iyisiydi en azından bir nevi temizdi. Setur tarafıma 23.05.2025 tarihinde dönüş yaptı ve hizmet alım süremin sonuna geldiği için özür dilemek dışında yapabilecekleri bir şey olmadığını belirtti. 4.800.-tl Setur 'a ödediğim bu otelin bu ederi olmadığını, en azından yarı ücretimin iadesi edilmesi teklifinin yapılmasını beklediğimi belirtmeme rağmen topu otele attılar. Ben müşteri olarak ödemeyi yaptığım kurumu muhatap alırım, özelikle beni hizmet alım süremin üzerinden 4 gün geçtikten sonra arayıp yapılacak bir şey yok demeleri bilinçli bir davranıştır. Hizmet aracılığı yaptıkları lokasyonları gezip müşteriye yanıltıcı bilgi veri vermeden hizmet sunmalılar. Özet olarak ekte bulunan resimler, arama kayıtlarım, dönüş alınamaması ait tüm datalar ile gerekli tüketici haklarım savunulacaktır.",,"Değerli Misafirimiz;

Şikayetiniz tarafımıza ulaşmıştır. Şikayetiniz, yetkililer tarafından incelenip tarafınıza en kısa sürede geri dönüş sağlanacaktır.

Saygılarımızla",https://www.sikayetvar.com/setur-turizm/seturdan-kirli-ve-sorunlu-oda-magduriyeti-uzerine-ilgisiz-musteri-hizmeti,0,[]
32559561,Setur'dan İade Sürecinde Beklenmedik Euro Kesintisi Ve İletişim Sorunu,,25 Mayıs 22:33,,2.599,0,,"Setur adına hiç yakışmayan küçük hesaplarla maalesef güvenimizi kaybettik. Temmuz ayında gerçekleşecek yurt dışı paket turunu 5 ay önce satın aldığımda, çağrı merkezi görevlisi ödemeyi Euro olarak yapmam durumunda herhangi bir iptal halinde geri ödemeyi de yine Euro olarak alacağımı ve bir kaybım olmayacağını belirtti. Araştırmalarım sırasında Setur'un TL ödemelerde kuru, diğer seyahat firmalarından daha yüksek bir şekilde aldığını fark ettiğim için ödemeyi Euro olarak, Setur'un bir Türk bankasındaki Euro hesabına havale ile yaptım. Ne yazık ki vize için randevu bile alamayınca 3 ay sonra iptal etmek zorunda kaldım ve iptal talebimi ilettim. Bir süre sonra, iadenin ödemeyi yaptığım günkü Euro kuru üzerinden TL olarak yapılacağını bildiren bir mail alınca çağrı merkezini arayarak itiraz ettim. Ödemenin Euro olarak iade edileceği tüm kayıtlarda olduğu için bu konu uzamadı ve neyse ki bir iki gün içinde iadem yapıldı. Ancak, ödeme yabancı bir banka üzerinden SWIFT ile gönderildiği için hesabımdan 21 Euro kesinti oldu. Hem çağrı merkezi üzerinden hem de mail yoluyla itiraz etmeme rağmen hiçbir dönüş yapılmadı. Hiç alamadığım bir hizmet için 1000 TL'ye yakın kaybım oldu. Bu süreci Setur gibi bir firmaya hiç yakıştıramadım ve bir daha kesinlikle tercih etmeyeceğim.",,,https://www.sikayetvar.com/setur-turizm/seturdan-iade-surecinde-beklenmedik-euro-kesintisi-ve-iletisim-sorunu,0,[]
32555448,Setur Marina Otoparkında Aileme Anlayışsız Ve Tehditkar Personel Tutumu,,25 Mayıs 12:34,,1.291,0,,"24 Mayıs 2025 tarihinde kendi aracımla Setur Marina’ya giriş yaptım. Ardından a****, b**** ve o**** başka bir araçla gelmek istediler; ancak otoparkın dolu olduğu gerekçesiyle içeri alınmadılar. Bu sebeple ailem, çocuklu olmalarına rağmen araçlarını uzakta bir noktaya park etmek zorunda kaldı.Benim aracım içeride olduğundan, ailemi Nişanımız olan Paysage Restoran’a götürebildim. Akşam saatlerinde ailemin aracı uzakta olduğu için, bariyerdeki duram arkadaşlara durumu izah edip kısa süreliğine çıkış yaparak, Kapıdaki görevlilere “Yakın zamanda döneceğim, sadece ailemi bırakmak için çıkıyorum” diyerek kimliğimi teslim edip otoparktan ayrıldım.Kısa süre sonra geri döndüğümde, benden yeniden otopark ücreti talep edildi. Durumu çalışanlara açık bir şekilde anlatmama, çıkmadan önce bilgi vermeme ve içerideki aracımın kayıtlı olmasına rağmen anlayış gösterilmedi. Üstelik sanki yeni hapishaneden çıkmışçasına çalışan personel tehditkar bir tutumla karşılaştım. “Ben bir şey yapamam, akşam seninle görüşürüz, burada sıkıntı çıkar, ” gibi ifadeler kullanıldı.Polis çağıracağımı söylediğimde ise, “Çağırın, onlarla da gelsin, ” diyerek kimsenin devletin polisinin takmadığı bir Marina olmuş",,,https://www.sikayetvar.com/setur-turizm/setur-marina-otoparkinda-aileme-anlayissiz-ve-tehditkar-personel-tutumu,0,[]
32547519,Otel Rezervasyonunda İndirim Ve Worldpuan Hakkımın İptal Edilmesi,,24 Mayıs 11:45,,899,0,,"Merhaba,03.05.2025 tarihinde Setur Acentası üzerinden KoçAilem Ayın Oteli konseptinde Rubi Platinum SPA Oteli satın aldım. Voucher No: 1385391. Otel fiyatından hem KoçAilem Ayın Oteli indirimi hem de Worldcard ile ödemede %5 indirimle birlikte toplamda 78.000 TL ödedim. Ek olarak 5.000 TL Worldpuan hak edişim de oluştu.23.05.2025 tarihinde otel fiyatında bir değişiklik olup olmadığını kontrol ettim ve aynı kampanya şartlarında otelin 70.537 TL'ye düştüğünü gördüm. Ekran görüntüsünü aldım. Acente ile bu konu hakkında görüştüm. Kontrollerini gerçekleştirdiler ve evet, böyle bir durum olduğunu, aradaki fiyat farkı iadesi için talepte bulunacaklarını söylediler. Ancak Setur üzerinden acenteye dönüş yapılarak bunun bir sistem açığı olduğu, iki kampanyanın birlikte kullanılamayacağı ve indirim hakkımın geçersiz sayıldığı belirtildi. Ayrıca Setur, kendi sitesi üzerinden de değişiklik yaparak Worldcard kampanyasını kaldırdı ve fiyat farkı iadesi olursa Worldpuan'ın da iptal olacağı bilgisini aktardı. Hem benim hakkım yenmiş oldu hem de yeni rezervasyon yapacak kişilerin hakkı zedelenmiş oldu.
Şimdi, hak etmiş olduğum ve kanıtları da bulunan otel fiyatı indirim hakkım ile hak ettiğim Worldpuan'ımı, ilk yaptığım alışverişin şartları ne ise aynı şekilde kullanmak istiyorum. Eğer bu hakkım sağlanamayacaksa, yıllardır Koç Grubu çalışanı ve müşterisi olan biri olarak büyük bir mağduriyet yaşıyorum.
Setur mağduriyetimi gidermediği takdirde, tüketici olarak tüm yasal haklarımı sonuna kadar arayacağım ve bu süreçteki yıpranmamın da haklarını ayrıca talep edeceğim. Yaşanan bu süreci kamuoyuna duyurmak için çaba göstereceğim.
Konunun ivedilikle çözülmesini talep ediyorum.",,,https://www.sikayetvar.com/setur-turizm/otel-rezervasyonunda-indirim-ve-worldpuan-hakkimin-iptal-edilmesi,0,[]
32540532,Kur Farkı Nedeniyle Oluşan Zararımın Telafisini Talep Ediyorum,,23 Mayıs 15:35,,1.240,0,,"26 Şubat 2025 tarihinde gerçekleştirdiğim rezervasyon kapsamında, Setur firmasına toplam 2.896 Euro tutarındaki ücretin 1.819 Euro’luk kısmını Şubat ayında, 1.081 Euro’luk kısmını ise Mayıs ayında ödemiş bulunmaktaydım. Ancak ne yazık ki, söz konusu tur yeterli katılım sağlanamadığı gerekçesiyle Setur tarafından iptal edildi.
Bu süreçte, Şubat 2025 ile Mayıs 2025 tarihleri arasında Türk Lirası'nın Euro karşısında yaklaşık %16 oranında değer kaybetmesi sonucunda, ilk ödemeyi yaptığım tarih ile tutarın tarafıma iade edildiği tarih arasındaki kur farkı sebebiyle yaklaşık 280 Euro tutarında bir kur farkı zararım oluşmuştur. Firmadan bu tutarı talep ettiğimde haksız bir uygulama ile karşılaştım ve Şubat ayında ödediğim TL tutarı tarafıma iade edildi. Benden parayı çekerken o günkü Euro kuruna göre çekmişlerdi, ancak öderken o günkü Euro kuruna değil, işlerine daha çok gelen 4 ay önce ödediğim TL değerine baktılar.
Kur değişimi sebebiyle yaşadığım 280 Euro'luk kaybımın telafi edilmesini talep ediyorum. (Bugünkü kur ile 12.423,6 TL kayıp)",,,https://www.sikayetvar.com/setur-turizm/kur-farki-nedeniyle-olusan-zararimin-telafisini-talep-ediyorum,0,[]
32538565,Tur Şirketinin İlgisizliği Ve Son Dakika Otel Değişikliği Mağduriyeti,,23 Mayıs 12:58,,228,0,,Tur aldık. Kafalarına göre otel belirleyip asla ilgilenmediler. Son dakika bilgi paylaşıyor ki müdahale şansı kalmasın! Aramamıza rağmen asla yardımcı olmadılar. Paranıza yazık kendiniz ayarlayın her şeyi gönlünüze göre olsun yoksa verdiğiniz paraya yazık.,,,https://www.sikayetvar.com/setur-turizm/tur-sirketinin-ilgisizligi-ve-son-dakika-otel-degisikligi-magduriyeti,0,[]
32522437,Setur'dan Aldığım Tatil Paketinde Fiyat Düşüşü Ve Yetersiz İade,,21 Mayıs 20:07,,922,1,,"Setur'dan maalesef 1 hafta önce Kıbrıs otel, uçak ve transfer paketi aldım. 93.000 TL ödediğim aynı tarihlerde, aynı uçak saatlerinde bugün paketin 85.000 TL olduğunu gördüm ve talebimi ilettim. Otelle görüşüp bana döndüklerinde, 589 TL gibi komik bir rakamın iade edileceğini ilettiler. İptal etmek istediğimde ise satın aldığım pakette 16.000 TL kesinti olacağını söylediler. Daha 1 hafta bile dolmadan aynı şartlarda bu turu satmanız nasıl bir hukuk, nasıl bir adalet? Gerekli tüm yerlerde yasal hakkımı arayacağım; CİMER'e, Tüketici Hakem Heyeti'ne, her yere şikayet dilekçemi vereceğim. Bir daha Setur mu, asla...",,,https://www.sikayetvar.com/setur-turizm/seturdan-aldigim-tatil-paketinde-fiyat-dususu-ve-yetersiz-iade,0,[]
32519940,"Onaylanan Rezervasyonum Keyfi İptal Edildi, Mağdur Edildim!",,21 Mayıs 16:15,,977,0,,"19.05.2025 tarihinde Setur acentesi tarafından Tuı Blue Tropical'e rezervasyon yaptırdık, işlem onaylandı ücret alındı. 21.05.2025 tarihinde iptal edeceklerini söylemek için aradılar. Otelde yer yokmuş, rezervasyonu kapatmış. Bu benim sorunum değil. Paramı alıyorlar. Rezervasyon yapıyorlar. Sonra iptal edeceğiz diyorlar. Otel asla yardımcı olmadı. Setur asla yardımcı olmadı. 2 aile gidecektik. Diğer aile sorunsuz gidiyor. Ama bizim acente yüzünden gidemiyoruz. Acil çözüm istiyorum. Bir daha Setur firmasıyla aşk böyle rezil gamsız bir acente görmedim.",,,https://www.sikayetvar.com/setur-turizm/onaylanan-rezervasyonum-keyfi-iptal-edildi-magdur-edildim,0,[]
32499230,Setur Ve Türk Telekom Prime Kampanyası Hakkında Belirsizlik Ve Kullanım Sorunu,,19 Mayıs 17:18,,509,0,,"Setur 'dan tatil rezervasyonu yapmaya çalışıyoruz. %5 Türk Telekom Prime kampanyasının tüm şartlarını sağlıyoruz fakat kampanyanın geçersiz olduğunu söylüyorlar ve kampanyayı kullanamıyoruz. Ne Türk Telekom ne de Setur bize geçerli bir açıklama yapmıyor. Kimsenin net bir cevabı yok. Kampanyanın reklamı hem Türk Telekom hem de Setur 'da yayınlanmakta. Kampanya tarihi, otel vb. Tüm şartlar sağlanmaktadır. Setur çalışanları bu kampanyanın geçersiz olduğunu iddia ediyor",,"Değerli Misafirimiz;

Şikayetiniz tarafımıza ulaşmıştır. Şikayetiniz, yetkililer tarafından incelenip tarafınıza en kısa sürede geri dönüş sağlanacaktır.

Saygılarımızla",https://www.sikayetvar.com/setur-turizm/setur-ve-turk-telekom-prime-kampanyasi-hakkinda-belirsizlik-ve-kullanim-sorunu,0,[]
32488031,Setur'dan Şikayetime Bir Yıldır Yanıt Alamıyorum,,18 Mayıs 00:36,,509,0,,18.08.2024-25.08.2024 tarihleri arasında İtalya turu ile ilgili şikayetimle ilgili hiçbir dönüş sağlanmadı. Yaklaşık 1 sene olmasına rağmen hiç kimse irtibata geçmedi. Daha öncesinde de Setur dan almış olduğum turlar vardı ama Setur tam bir pişmanlık. KoçAilem üyesi olduğum halde Koç grubundan beklenmeyen bir davranış. Yapmış olduğum şikayete kayıtsız kaldılar. Setur u tercih ederken tekrar düşün ek gerekiyor. Setur a yakışmayan bir davranış.,,,https://www.sikayetvar.com/setur-turizm/seturdan-sikayetime-bir-yildir-yanit-alamiyorum,0,[]
32484273,Kuşadası Setur Marina Sorunları,,17 Mayıs 17:10,,1.519,0,,,,"Video da anlattığım gibi Kuşadası Setur Marina yatçı şikayetleri, otopark, pontonlara ulaşım, AVM inşaatı toz toprak gürültü, olabilecek güvenlik sorunları",https://www.sikayetvar.com/setur-turizm/kusadasi-setur-marina-sorunlari-video,0,[]
32448531,"Setur, Rezervasyon Yapılmadan Paraf Puanlarımı İzinsiz Çekti",,14 Mayıs 01:08,,1.237,0,,Seturun web sitesinden otel rezervasyonu yaptırmak için ilerlediğimde kredi kartı puanımı ödeyeceğim miktarın kaça düşeceğini görüntülemek için tıkladığımda rezervasyon yaptırmadığım halde Paraf puanlarımı Setur izinsiz çekmiştir. İvedilikle tarafıma iade yapılmasını istiyorum.,,"Değerli Misafirimiz;

Şikayetiniz tarafımıza ulaşmıştır. Şikayetiniz, yetkililer tarafından incelenip tarafınıza en kısa sürede geri dönüş sağlanacaktır.

Saygılarımızla",https://www.sikayetvar.com/setur-turizm/setur-rezervasyon-yapilmadan-paraf-puanlarimi-izinsiz-cekti,0,[]
32418622,"Setur Ve Banka Arasındaki Kampanya Puanları Yatırılmıyor, Mağduriyetim Çözülmüyor",,11 Mayıs 08:37,,630,0,,"1. 07 Şubat 2025 tarihinde Setur'a (Ankara Ö*** Tour/Antares AVM) İtalya turu için başvurdum. Görevli personel işlemi yaptı; 4 kişilik rezervasyon yaptık, eşimin kartıyla bir kişilik %25'lik ödeme yaptık. Personel, Yapı Kredi'de kampanya olduğunu, 40.000 TL üzerine 2500 World puan kazanacağımızı belirtti. Ödediğimiz tutar 53.000 TL olduğu için bir sonraki ay 2500 World puan yatırıldı.2. 17 Mart 2025'te kampanya yenilendi, eşimin kartıyla bir kişinin de ödemesini gerçekleştirdik. Aynı kampanya, aynı Setur Antares AVM'de (bir ay sonra el değiştirmiş, Setur levhası aynı, acente ismi değişmiş, 'İ***' adında) bu sefer başka bir personel aracılığıyla yeni Mart ayı kampanyasına katıldık, 57.000 TL ödeme yaptık. Nisan ayında yatırılması gereken World puan yatırılmadı. Gerekçe olarak banka, başka POS cihazından çekilmiş diyor. Acente, bizim başka POS cihazından çekme ihtimalimiz olmadığını, geçen ay yaptığımız gibi yaptığımızı söyledi. Daha sonra kampanyanın kişi bazlı olduğu, bir kere kullanıldığı vb. gibi açıklamalar yapıldı; ikisi de oyalama, gerçeği yansıtmıyor. Kampanyaya katıldık çünkü ay değişti, öyle bir durum olsa kampanyaya katılımı banka kabul etmezdi. Başka POS cihazından çekilmiş diyorlar, halbuki ilk ay ne yaptıysak aynısını yaptık. Ödeme dekontları aynı şekilde. Acente, kampanyanın kişi bazlı olduğuna inanarak ben de kendime Yapı Kredi'den, Garanti'deki limitlerimi düşürerek yeni kredi kartı çıkardım.3. 11 Nisan 2025 tarihinde kendime ait Yapı Kredi kartıyla kampanyaya katılarak (yurtdışı tur, tek çekim, Setur acentası, 120.000 TL üzeri 7500 World puan) 121.300 TL ödeme gerçekleştirdim. Bu arada aynı dükkanda Setur levhası duruyor (acente ismi Ankara Moon Walk Tour olmuş), ilginç bir şekilde üç ayda üç acente değişmiş, Setur levhası aynen kalmış. 07 Mayıs 2025'te 7500 World puan yatması gerekirken yine yatmadı. Banka, 'bizimle alakası yok, Yapı Kredi POS'undan geçilmemiş' diyor, Setur müşteri temsilcileri ise 2 aydır eşimin kartına ödenmesi gereken puanla ilgilenmiyor, geri dönüş yapmıyor.",,Ödemeler ekte sunulmuştur.,https://www.sikayetvar.com/setur-turizm/setur-ve-banka-arasindaki-kampanya-puanlari-yatirilmiyor-magduriyetim-cozulmuyor,0,[]
32410170,"Setur Turizm Yanlışlıkla Alınan Bilette Esneklik Yok, Mağduriyetime Çözüm Bulunmuyor",,10 Mayıs 07:40,,3.192,0,,"Setur acentesi üzerinden yurt dışına yapacağımız ailecek seyahatimiz için yanlışlıkla değişiklik yapılamayan kategoriden bilet aldığımı fark ettim. Bileti aldığım gün, bilet kategorisinde değişiklik yapmak için hem Setur 'u hem de THY'yi aradığımda olumsuz cevap aldım.Yanlışlıkla aldığımı söylüyorum, ücret farkını vereceğimi söylüyorum, vizenin reddi durumunda mağdur olacağımı belirtiyorum ancak kimse yardımcı olmuyor.Bu kadar katı bir tutum olabilir mi ya?
Lütfen duyarlı biri bu sorunuma çözüm için yardımcı olsun.",,,https://www.sikayetvar.com/setur-turizm/setur-turizm-yanlislikla-alinan-bilette-esneklik-yok-magduriyetime-cozum-bulunmuyor,0,[]
32385655,Onaylanan Rezervasyonum Fiyat Gerekçesiyle Haksız Yere İptal Edildi,,07 Mayıs 19:25,,1.716,0,,"Setur Turizm’in kendi resmi internet sitesi üzerinden 30 Mayıs - 1 Haziran 2025 tarihleri arasında iki gecelik konaklama için rezervasyon yaptım. Ödeme kredi kartı ile anında alındı ve rezervasyonum sistem tarafından onaylandı. Ancak 20 gün kala müşteri hizmetleri tarafından aranarak, “fiyatların güncel olmadığı” gerekçesiyle rezervasyonun iptal edilmesi gerektiği söylendi.
Bu durum açıkça yasalara aykırıdır. 6502 sayılı Tüketicinin Korunması hakkında Kanun’un 6. Ve 8. Maddeleri ile Mesafeli Sözleşmeler Yönetmeliği’nin 12. Maddesi gereğince, ödemesi alınmış ve onaylanmış bir rezervasyonun fiyat gerekçesiyle tek taraflı olarak iptal edilmesi hukuken mümkün değildir.
Setur gibi köklü ve güvenilir olduğunu düşündüğüm bir firmanın bu şekilde tüketiciyi mağdur etmesi kabul edilemez. Mağduriyetimin acilen giderilmesini, rezervasyonumun aynı şartlarda korunmasını talep ediyorum. Aksi halde Tüketici Hakem Heyeti, Ticaret Bakanlığı ve gerekirse adli merciler dahil tüm yasal yollara başvuracağımı bildiririm.
Talebim:Ödemesi alınan ve onaylanan rezervasyonun iptal edilmeden, orijinal haliyle geçerli tutulması.",,,https://www.sikayetvar.com/setur-turizm/onaylanan-rezervasyonum-fiyat-gerekcesiyle-haksiz-yere-iptal-edildi,0,[]
32372595,"Karadağ'da Havalimanında Saatlerce Bekletildik, Mağdur Edildik",,06 Mayıs 15:51,,1.359,0,,"Setur'dan tur satın aldık, Karadağ'da havalimanında tam 11 saat bekledik.15.10'daki uçuşumuz gece 12'de gerçekleşti, yarım gün boyunca havalimanında kaldık, saatlerce yemek ve su verilmedi. Havalimanından evlerimize dönmek için aldığımız biletler yandı. Setur tarafından aranmadık bile. Böyle bir acenteye güvenmemek gerektiğini düşünüyorum.",,,https://www.sikayetvar.com/setur-turizm/karadagda-havalimaninda-saatlerce-bekletildik-magdur-edildik,0,[]
